{
  "schemaVersion": "llm.knowledge-parse.v0",
  "knowledgeItemId": "ki-task-session-20260307-a1-001",
  "taskId": "task-session-20260307-a1-001",
  "sessionId": "session-20260307-a1",
  "objective": "在 Safari 中复现任务 task-session-20260307-a1-001 的操作流程",
  "context": {
    "appName": "Safari",
    "appBundleId": "com.apple.Safari",
    "windowTitle": "OpenStaff - GitHub"
  },
  "executionPlan": {
    "requiresTeacherConfirmation": true,
    "steps": [
      {
        "stepId": "step-001",
        "actionType": "click",
        "instruction": "执行第 1 步点击操作（源事件 11111111-1111-4111-8111-111111111111）。",
        "target": "unknown",
        "sourceEventIds": [
          "11111111-1111-4111-8111-111111111111"
        ]
      },
      {
        "stepId": "step-002",
        "actionType": "click",
        "instruction": "执行第 2 步点击操作（源事件 22222222-2222-4222-8222-222222222222）。",
        "target": "unknown",
        "sourceEventIds": [
          "22222222-2222-4222-8222-222222222222"
        ]
      }
    ],
    "completionCriteria": {
      "expectedStepCount": 2,
      "requiredFrontmostAppBundleId": "com.apple.Safari"
    },
    "failurePolicy": {
      "onContextMismatch": "stopAndAskTeacher",
      "onStepError": "stopAndAskTeacher",
      "onUnknownAction": "stopAndAskTeacher"
    }
  },
  "safetyNotes": [
    "执行前前台应用必须是 com.apple.Safari。",
    "执行该知识条目时，需要老师确认后再执行。",
    "坐标点击目标可能随分辨率或界面变化漂移。"
  ],
  "confidence": 0.86
}
